{
    "mode": "default",
    "size": {
        "cols": 4,
        "rows": 2,
        "rotation": 0,
        "width": 105,
        "height": 148
    },
    "sheet": {
        "width": 460,
        "height": 320
    },
    "border": 2,
    "outfile": "./out.pdf",
    "cards": [{
        "front": "./example-f.png",
        "back": "./example-b.png"
    }]
}